{
  "$schema": "https://json-schema.org/draft/2020-12/schema",
  "$id": "https://kis-mcp.local/contracts/providers/serena/settings.schema.json",
  "type": "object",
  "additionalProperties": false,
  "required": [
    "schema_version", "enabled", "namespace", "source_repository",
    "source_revision", "package_name", "package_version", "package_sha256",
    "project_boundary", "install_root", "executable", "arguments",
    "home_root", "config_root", "cache_root", "log_root", "temp_root",
    "language_server_root", "global_memory_root", "project_data_directory",
    "environment_names"
  ],
  "properties": {
    "schema_version": {"const": 1},
    "enabled": {"type": "boolean"},
    "namespace": {"const": "serena"},
    "source_repository": {"const": "https://github.com/oraios/serena"},
    "source_revision": {"const": "bcac0969fb8685783ea6d0f2642468fcc47e6395"},
    "package_name": {"const": "serena-agent"},
    "package_version": {"const": "1.6.1"},
    "package_sha256": {"const": "04ddd985bd3feb25598ab8732bf3a998f961d5b46dce271b816126c0a68a91e1"},
    "project_boundary": {"const": "C:\\Projects"},
    "install_root": {"type": "string", "pattern": "^C:\\\\Projects\\\\\\.kis-mcp\\\\serena$"},
    "executable": {"const": "C:\\Projects\\.kis-mcp\\serena\\venv\\Scripts\\python.exe"},
    "arguments": {"const": ["-c", "from serena.cli import top_level; top_level()", "start-mcp-server", "--context=codex", "--project-from-cwd", "--enable-web-dashboard=false", "--open-web-dashboard=false", "--enable-gui-log-window=false"]},
    "home_root": {"type": "string"},
    "config_root": {"type": "string"},
    "cache_root": {"type": "string"},
    "log_root": {"type": "string"},
    "temp_root": {"type": "string"},
    "language_server_root": {"type": "string"},
    "global_memory_root": {"type": "string"},
    "project_data_directory": {"const": ".serena"},
    "environment_names": {"type": "array", "uniqueItems": true, "items": {"type": "string", "pattern": "^[A-Z_][A-Z0-9_]*$"}}
  }
}